{
  "server": {
    "url": "https://sonarqube.demo.kosli.com",
    "version": "2025.1.0.102418",
    "edition": "developer"
  },
  "project": {
    "key": "kosli-dev_orders-api",
    "name": "orders-api",
    "branch": "main",
    "url": "https://sonarqube.demo.kosli.com/dashboard?id=kosli-dev_orders-api"
  },
  "analysis": {
    "id": "AZmR9pQ1hK4vB2sT7fLw",
    "revision": "REPLACED_BY_CI",
    "date": "REPLACED_BY_CI",
    "quality_profile": "Sonar way (Java)",
    "quality_gate": "Kosli demo gate"
  },
  "projectStatus": {
    "status": "OK",
    "ignoredConditions": false,
    "conditions": [
      {
        "metricKey": "new_reliability_rating",
        "comparator": "GT",
        "errorThreshold": "1",
        "actualValue": "1",
        "status": "OK"
      },
      {
        "metricKey": "new_security_rating",
        "comparator": "GT",
        "errorThreshold": "1",
        "actualValue": "1",
        "status": "OK"
      },
      {
        "metricKey": "new_maintainability_rating",
        "comparator": "GT",
        "errorThreshold": "1",
        "actualValue": "1",
        "status": "OK"
      },
      {
        "metricKey": "new_security_hotspots_reviewed",
        "comparator": "LT",
        "errorThreshold": "100",
        "actualValue": "100",
        "status": "OK"
      },
      {
        "metricKey": "new_coverage",
        "comparator": "LT",
        "errorThreshold": "80",
        "actualValue": "86.4",
        "status": "OK"
      },
      {
        "metricKey": "new_duplicated_lines_density",
        "comparator": "GT",
        "errorThreshold": "3",
        "actualValue": "0.0",
        "status": "OK"
      }
    ]
  },
  "measures": {
    "bugs": 0,
    "vulnerabilities": 0,
    "security_hotspots": 0,
    "code_smells": 7,
    "coverage": 86.4,
    "duplicated_lines_density": 0.0,
    "ncloc": 214
  }
}
